{
  "version": 1,
  "surface": "anchor-resolve",
  "source": "GUIDERS-ADR-0025 Phase 2 + LegacyBracketRelationWire boundary + Kind: RelationSpec dual path",
  "vectors": [
    {
      "id": "code-file-member-line",
      "wire": "[F:Program.cs;M:Foo;L:10]",
      "expect": {
        "family": "Csharp",
        "file": "Program.cs",
        "memberKey": "Foo",
        "lineStart": 10,
        "lineEnd": 10
      }
    },
    {
      "id": "code-scope-index",
      "wire": "[F:a.cs;S:for:2]",
      "expect": {
        "family": "Csharp",
        "file": "a.cs",
        "scopeKind": "for",
        "scopeIndex": 2
      }
    },
    {
      "id": "xml-element",
      "wire": "[Family:xml;F:doc.xml;X:Root/Item]",
      "expect": {
        "family": "Xml",
        "familyName": "xml",
        "file": "doc.xml",
        "xmlPath": "Root/Item"
      }
    },
    {
      "id": "json-member",
      "wire": "[F:data.json;J:$.items[0].name]",
      "expect": {
        "family": "Json",
        "file": "data.json",
        "memberKey": "$.items[0].name"
      }
    },
    {
      "id": "navigation-nested",
      "wire": "[Family:navigation;Command:open;Anchor:[F:README.md;L:10]]",
      "expect": {
        "family": "Navigation",
        "familyName": "navigation",
        "command": "open",
        "nestedAnchor": {
          "family": "Csharp",
          "file": "README.md",
          "lineStart": 10,
          "lineEnd": 10
        }
      }
    },
    {
      "id": "navigation-legacy-n-flag",
      "wire": "[N:true;Command:peek;Anchor:[F:Inner.cs;M:B]]",
      "expect": {
        "family": "Navigation",
        "familyName": "navigation",
        "command": "peek",
        "nestedAnchor": {
          "family": "Csharp",
          "file": "Inner.cs",
          "memberKey": "B"
        }
      }
    },
    {
      "id": "kind-code-edit-member",
      "mode": "kind-spec",
      "wire": "[Kind:CodeEdit; File:Program.cs; Member:Foo]",
      "expect": {
        "relationSpecCase": "CodeEdit",
        "file": "Program.cs",
        "memberKey": "Foo"
      }
    },
    {
      "id": "kind-code-edit-xml-element",
      "mode": "kind-spec",
      "wire": "[Kind:CodeEdit; File:doc.xml; Element:Root/Item]",
      "expect": {
        "relationSpecCase": "CodeEdit",
        "file": "doc.xml",
        "xmlPath": "Root/Item"
      }
    },
    {
      "id": "kind-nav-seed",
      "mode": "kind-spec",
      "wire": "[Kind:Nav; File:README.md; Line:10; Command:open]",
      "expect": {
        "relationSpecCase": "Nav"
      }
    }
  ]
}
